{
  "$schema": "https://raw.githubusercontent.com/tdwg/cd/review/json-schemas-dev/standard/schemas/json/2.0/latimer-core-schema.json",
  "$id": "https://raw.githubusercontent.com/tdwg/cd/review/json-schemas-dev/standard/schemas/vocabulary/2.0/person.json",
  "title": "Person",
  "description": "A person (alive or dead). This concept should map to the Schema.org Person class (https://schema.org/Person), and the prov:Person class (http://www.w3.org/ns/prov#Person) in the PROV ontology. In the latter, it is a subclass of prov:Agent, which through which it can map to the RDA recommendations on attribution (http://dx.doi.org/10.15497/RDA00029). The definition is appropriated from the Schema.org class.",
  "type": "object",
  "properties": [
	{
			"name": "additionalName",
			"description": "An additional name for a Person, can be used for a middle name.",
			"type": "string"
		},
		{
			"name": "familyName",
			"description": "Family name. In the U.S., the last name of a Person.",
			"type": "string"
		},
		{
			"name": "fullName",
			"description": "Preferred form of personal name for display as a string.",
			"type": "string"
		},
		{
			"name": "givenName",
			"description": "Given name. In the U.S., the first name of a Person.",
			"type": "string"
		},
		{
			"name": "hasAddress",
			"description": "This property refers to one or more related instances of the Address class.",
			"type": "array",
			"items": {
		  "$ref": "https://raw.githubusercontent.com/tdwg/cd/review/json-schemas-dev/standard/schemas/vocabulary/2.0/address.json"
		},
			"minItems": 0,
			"uniqueItems": true
		},
		{
			"name": "hasContactDetail",
			"description": "This property refers to one or more related instances of the ContactDetail class.",
			"type": "array",
			"items": {
		  "$ref": "https://raw.githubusercontent.com/tdwg/cd/review/json-schemas-dev/standard/schemas/vocabulary/2.0/contact-detail.json"
		},
			"minItems": 0,
			"uniqueItems": true
		},
		{
			"name": "hasIdentifier",
			"description": "This property refers to one or more related instances of the Identifier class.",
			"type": "array",
			"items": {
		  "$ref": "https://raw.githubusercontent.com/tdwg/cd/review/json-schemas-dev/standard/schemas/vocabulary/2.0/identifier.json"
		},
			"minItems": 0,
			"uniqueItems": true
		},
		{
			"name": "hasMeasurementOrFact",
			"description": "This property refers to one or more related instances of the MeasurementOrFact class.",
			"type": "array",
			"items": {
		  "$ref": "https://raw.githubusercontent.com/tdwg/cd/review/json-schemas-dev/standard/schemas/vocabulary/2.0/measurement-or-fact.json"
		},
			"minItems": 0,
			"uniqueItems": true
		},
		{
			"name": "hasReference",
			"description": "This property refers to one or more related instances of the Reference class.",
			"type": "array",
			"items": {
		  "$ref": "https://raw.githubusercontent.com/tdwg/cd/review/json-schemas-dev/standard/schemas/vocabulary/2.0/reference.json"
		},
			"minItems": 0,
			"uniqueItems": true
		}
	]
}