{
  "$schema": "https://raw.githubusercontent.com/tdwg/cd/review/json-schemas-dev/standard/schemas/json/2.0/latimer-core-vocabulary.schema.json",
  "$id": "https://raw.githubusercontent.com/tdwg/cd/review/json-schemas-dev/standard/schemas/vocabulary/2.0/reference.json",
  "title": "Reference",
  "description": "A reference to external resources and information related to the collection description. In the Collection Description standard, this class can be used to store references to publications, policies, datasets and other online resources such as websites, related to classes within the standard.",
  "type": "object",
  "properties": [
	{
			"name": "hasIdentifier",
			"description": "This property refers to one or more related instances of the Identifier class.",
			"type": "array",
			"items": {
		  "$ref": "https://raw.githubusercontent.com/tdwg/cd/review/json-schemas-dev/standard/schemas/vocabulary/2.0/identifier.json"
		},
			"minItems": 0,
			"uniqueItems": true
		},
		{
			"name": "referenceDetails",
			"description": "Detailed information about the resource being referenced.",
			"type": "string"
		},
		{
			"name": "referenceText",
			"description": "A short title for the reference.",
			"type": "string"
		},
		{
			"name": "referenceType",
			"description": "The type of resource being referenced.",
			"type": "string"
		},
		{
			"name": "resourceURI",
			"description": "A preferably resolvable URI to uniquely identify a concept.",
			"type": "string"
		}
	]
}