{
  "$schema": "https://raw.githubusercontent.com/tdwg/cd/review/json-schemas-dev/standard/schemas/json/2.0/chronometric-age-schema.json",
  "$id": "https://raw.githubusercontent.com/tdwg/cd/review/json-schemas-dev/standard/schemas/vocabulary/2.0/chronometric-age.json",
  "title": "Chronometric Age",
  "description": "The age of a specimen or related materials that is generated from a dating assay. This is a categorical term (class) to organize the other chronometric age properties and does not ever have values.",
  "type": "object",
  "properties": [
	{
			"name": "chronometricAgeProtocol",
			"description": "A description of or reference to the methods used to determine the ChronometricAge.",
			"type": "string"
		},
		{
			"name": "chronometricAgeRemarks",
			"description": "Notes or comments about the ChronometricAge.",
			"type": "string"
		},
		{
			"name": "chronometricAgeUncertaintyInYears",
			"description": "The temporal uncertainty of the earliestChronometricAge and latestChronometicAge in years.",
			"type": "number"
		},
		{
			"name": "earliestChronometricAge",
			"description": "The maximum/earliest/oldest possible age of a specimen as determined by a dating method.",
			"type": "number"
		},
		{
			"name": "earliestChronometricAgeReferenceSystem",
			"description": "The reference system associated with the earliestChronometricAge.",
			"type": "string"
		},
		{
			"name": "hasIdentifier",
			"description": "This property refers to one or more related instances of the Identifier class.",
			"type": "array",
			"items": {
		  "$ref": "https://raw.githubusercontent.com/tdwg/cd/review/json-schemas-dev/standard/schemas/vocabulary/2.0/identifier.json"
		},
			"minItems": 0,
			"uniqueItems": true
		},
		{
			"name": "hasMeasurementOrFact",
			"description": "This property refers to one or more related instances of the MeasurementOrFact class.",
			"type": "array",
			"items": {
		  "$ref": "https://raw.githubusercontent.com/tdwg/cd/review/json-schemas-dev/standard/schemas/vocabulary/2.0/measurement-or-fact.json"
		},
			"minItems": 0,
			"uniqueItems": true
		},
		{
			"name": "hasReference",
			"description": "This property refers to one or more related instances of the Reference class.",
			"type": "array",
			"items": {
		  "$ref": "https://raw.githubusercontent.com/tdwg/cd/review/json-schemas-dev/standard/schemas/vocabulary/2.0/reference.json"
		},
			"minItems": 0,
			"uniqueItems": true
		},
		{
			"name": "latestChronometricAge",
			"description": "The minimum/latest/youngest possible age of a specimen as determined by a dating method.",
			"type": "number"
		},
		{
			"name": "latestChronometricAgeReferenceSystem",
			"description": "The reference system associated with the latestChronometricAge.",
			"type": "string"
		},
		{
			"name": "verbatimChronometricAge",
			"description": "The verbatim age for a specimen, whether reported by a dating assay, associated references, or legacy information.",
			"type": "string"
		}
	]
}