{
  "$schema": "https://raw.githubusercontent.com/tdwg/cd/review/json-schemas-dev/standard/schemas/json/2.0/latimer-core-vocabulary.schema.json",
  "$id": "https://raw.githubusercontent.com/tdwg/cd/review/json-schemas-dev/standard/schemas/vocabulary/2.0/geological-context.json",
  "title": "Geological Context",
  "description": "Geological information, such as stratigraphy, that qualifies a region or place.",
  "type": "object",
  "properties": [
	{
			"name": "bed",
			"description": "The full name of the lithostratigraphic bed from which the cataloged item was collected.",
			"type": "string"
		},
		{
			"name": "earliestAgeOrLowestStage",
			"description": "The full name of the earliest possible geochronologic age or lowest chronostratigraphic stage attributable to the stratigraphic horizon from which the cataloged item was collected",
			"type": "string"
		},
		{
			"name": "earliestEonOrLowestEonothem",
			"description": "The full name of the earliest possible geochronologic eon or lowest chrono-stratigraphic eonothem or the informal name (Precambrian) attributable to the stratigraphic horizon from which the cataloged item was collected.",
			"type": "string"
		},
		{
			"name": "earliestEpochOrLowestSeries",
			"description": "The full name of the earliest possible geochronologic epoch or lowest chronostratigraphic series attributable to the stratigraphic horizon from which the cataloged item was collected.",
			"type": "string"
		},
		{
			"name": "earliestEraOrLowestErathem",
			"description": "The full name of the earliest possible geochronologic era or lowest chronostratigraphic erathem attributable to the stratigraphic horizon from which the cataloged item was collected.",
			"type": "string"
		},
		{
			"name": "earliestPeriodOrLowestSystem",
			"description": "The full name of the earliest possible geochronologic period or lowest chronostratigraphic system attributable to the stratigraphic horizon from which the cataloged item was collected.",
			"type": "string"
		},
		{
			"name": "formation",
			"description": "The full name of the lithostratigraphic formation from which the cataloged item was collected.",
			"type": "string"
		},
		{
			"name": "group",
			"description": "The full name of the lithostratigraphic group from which the cataloged item was collected.",
			"type": "string"
		},
		{
			"name": "hasIdentifier",
			"description": "This property refers to one or more related instances of the Identifier class.",
			"type": "array",
			"items": {
		  "$ref": "https://raw.githubusercontent.com/tdwg/cd/review/json-schemas-dev/standard/schemas/vocabulary/2.0/identifier.json"
		},
			"minItems": 0,
			"uniqueItems": true
		},
		{
			"name": "hasMeasurementOrFact",
			"description": "This property refers to one or more related instances of the MeasurementOrFact class.",
			"type": "array",
			"items": {
		  "$ref": "https://raw.githubusercontent.com/tdwg/cd/review/json-schemas-dev/standard/schemas/vocabulary/2.0/measurement-or-fact.json"
		},
			"minItems": 0,
			"uniqueItems": true
		},
		{
			"name": "hasReference",
			"description": "This property refers to one or more related instances of the Reference class.",
			"type": "array",
			"items": {
		  "$ref": "https://raw.githubusercontent.com/tdwg/cd/review/json-schemas-dev/standard/schemas/vocabulary/2.0/reference.json"
		},
			"minItems": 0,
			"uniqueItems": true
		},
		{
			"name": "latestAgeOrHighestStage",
			"description": "The full name of the latest possible geochronologic age or highest chronostratigraphic stage attributable to the stratigraphic horizon from which the cataloged item was collected.",
			"type": "string"
		},
		{
			"name": "latestEonOrHighestEonothem",
			"description": "The full name of the latest possible geochronologic eon or highest chrono-stratigraphic eonothem or the informal name (Precambrian) attributable to the stratigraphic horizon from which the cataloged item was collected.",
			"type": "string"
		},
		{
			"name": "latestEpochOrHighestSeries",
			"description": "The full name of the latest possible geochronologic epoch or highest chronostratigraphic series attributable to the stratigraphic horizon from which the cataloged item was collected.",
			"type": "string"
		},
		{
			"name": "latestEraOrHighestErathem",
			"description": "The full name of the latest possible geochronologic era or highest chronostratigraphic erathem attributable to the stratigraphic horizon from which the cataloged item was collected.",
			"type": "string"
		},
		{
			"name": "latestPeriodOrHighestSystem",
			"description": "The full name of the latest possible geochronologic period or highest chronostratigraphic system attributable to the stratigraphic horizon from which the cataloged item was collected.",
			"type": "string"
		},
		{
			"name": "member",
			"description": "The full name of the lithostratigraphic member from which the cataloged item was collected.",
			"type": "string"
		}
	]
}